[
  {
    "id": "bfb05841-d5b8-43b1-ab09-564edd105332",
    "name": "SageMaker",
    "slug": "sagemaker",
    "tagline": "Developer Tools AI for train",
    "summary": "SageMaker is an AI-powered tool for Train, Deploy and more. Designed for Developers, MLOps, it offers fast workflows and useful integrations.",
    "website_url": "https://aws.amazon.com",
    "logo_url": "https://www.google.com/s2/favicons?sz=128&domain=aws.amazon.com",
    "gallery": [],
    "categories": [
      "Developer Tools"
    ],
    "tasks": [
      "Train",
      "Deploy"
    ],
    "job_roles": [
      "Developers",
      "MLOps"
    ],
    "pricing": {
      "model": "freemium",
      "plans": [
        {
          "name": "Free",
          "price": "$0",
          "features": [
            "Basic usage",
            "Community support"
          ]
        },
        {
          "name": "Pro",
          "price": "$19/mo",
          "features": [
            "Higher limits",
            "Priority support",
            "Advanced features"
          ]
        },
        {
          "name": "Team",
          "price": "$99/mo",
          "features": [
            "Team seats",
            "SSO",
            "Audit logs"
          ]
        }
      ]
    },
    "features": [
      "Templates",
      "Long-context",
      "RAG",
      "Batch actions",
      "Embeddings",
      "Export"
    ],
    "platforms": [
      "Web",
      "API",
      "iOS",
      "Android"
    ],
    "models": [
      "OpenAI",
      "Anthropic",
      "Llama 3.1"
    ],
    "integrations": [
      "Slack",
      "Zapier",
      "Notion",
      "GSheets"
    ],
    "languages": [
      "en",
      "es",
      "fr",
      "de",
      "hi",
      "ja"
    ],
    "maturity": "growing",
    "release_date": "2023-01-01",
    "updated_at": "2025-10-04",
    "status": "active",
    "compliance": [
      "GDPR",
      "SOC2"
    ],
    "vendor": {
      "name": "SageMaker",
      "hq_country": "US",
      "contact_email": "hi@aws.amazon.com",
      "twitter": "https://x.com/sagemaker",
      "linkedin": "https://www.linkedin.com/company/sagemaker"
    },
    "community": {
      "rating": 4.5,
      "votes": 3346,
      "reviews": []
    },
    "seo": {
      "keywords": [
        "Developer Tools",
        "Deploy",
        "Train"
      ],
      "canonical_url": "https://yourdomain.com/tools/sagemaker",
      "schema_org": [
        "SoftwareApplication",
        "Product"
      ]
    },
    "flags": {
      "free": true,
      "no_signup": false,
      "open_source": false,
      "mobile_app": true,
      "api_available": true,
      "on_device": false,
      "privacy_first": false,
      "educational": false,
      "nsfw": false,
      "verified": true
    },
    "links": {
      "docs": "https://aws.amazon.com/help",
      "changelog": "https://aws.amazon.com/changelog",
      "support": "https://aws.amazon.com/support",
      "pricing": "https://aws.amazon.com/pricing"
    },
    "affiliate": {
      "enabled": false,
      "link": "",
      "partner_id": ""
    },
    "moderation": {
      "submitted_by": "bulk-seed",
      "moderation_state": "approved",
      "notes": ""
    },
    "best_for": [
      "Solo creators",
      "Small teams",
      "Agencies",
      "Enterprises"
    ],
    "use_cases": [
      "Train",
      "Deploy",
      "Automations",
      "Reporting"
    ],
    "pros_cons": {
      "pros": [
        "Clean UI",
        "Solid performance",
        "Helpful docs",
        "Active community"
      ],
      "cons": [
        "Advanced features in paid plans",
        "Learning curve for complex flows"
      ]
    },
    "key_differentiators": [
      "Fast setup",
      "Good defaults",
      "Solid integrations",
      "Transparent pricing",
      "Active roadmap",
      "Helpful templates"
    ],
    "limitations": [
      "Team features require paid plan",
      "Rate limits on free tier"
    ],
    "setup_time": "15\u201345 min",
    "technical": {
      "context_tokens": 128000,
      "latency_ms": 500,
      "throughput_rps": 30,
      "sdk_languages": [
        "JS/TS",
        "Python"
      ]
    },
    "benchmarks": {
      "latency_ms_p50": 400,
      "latency_ms_p95": 1200,
      "note": "Indicative; varies by workload"
    },
    "import_export": [
      "CSV import",
      "CSV export",
      "Webhook"
    ],
    "data_controls": [
      "PII redaction",
      "Model selection",
      "Data regions (enterprise)"
    ],
    "governance": [
      "RBAC",
      "Audit logs",
      "SSO/SAML"
    ],
    "privacy": {
      "training_policy": "Enterprise data not used to train",
      "data_retention": "Configurable retention"
    },
    "security": {
      "certifications": [
        "SOC2"
      ],
      "sso": "SAML"
    },
    "limits": {
      "free_tier": "Yes",
      "rate_limits": "Varies by plan"
    },
    "uptime_slo": "99.95%",
    "ideal_industries": [
      "SaaS",
      "Ecommerce",
      "Media",
      "Education"
    ],
    "support_channels": [
      "Docs",
      "Email",
      "Community"
    ],
    "case_studies": [
      {
        "title": "Team productivity improved 2\u20133x",
        "url": "https://aws.amazon.com"
      }
    ],
    "migration_paths": [
      "CSV import",
      "API migration"
    ],
    "alternatives_notes": "Compare with peers in the same category for the closest fit.",
    "roadmap_highlights": [
      "New integrations",
      "Performance improvements"
    ],
    "pricing_notes": "Annual discounts available",
    "tutorials": [
      {
        "title": "SageMaker quick start",
        "url": "https://www.youtube.com/results?search_query=SageMaker+quick+start"
      },
      {
        "title": "SageMaker full tutorial",
        "url": "https://www.youtube.com/results?search_query=SageMaker+tutorial"
      },
      {
        "title": "SageMaker tips & tricks",
        "url": "https://www.youtube.com/results?search_query=SageMaker+tips"
      }
    ]
  },
  {
    "id": "848b98e7-f07f-4be2-ab4b-da7c33fccdef",
    "name": "Vertex AI",
    "slug": "vertex-ai",
    "tagline": "Developer Tools AI for train",
    "summary": "Vertex AI is an AI-powered tool for Train, Deploy and more. Designed for Developers, MLOps, it offers fast workflows and useful integrations.",
    "website_url": "https://cloud.google.com",
    "logo_url": "https://www.google.com/s2/favicons?sz=128&domain=cloud.google.com",
    "gallery": [],
    "categories": [
      "Developer Tools"
    ],
    "tasks": [
      "Train",
      "Deploy",
      "Agents"
    ],
    "job_roles": [
      "Developers",
      "MLOps"
    ],
    "pricing": {
      "model": "freemium",
      "plans": [
        {
          "name": "Free",
          "price": "$0",
          "features": [
            "Basic usage",
            "Community support"
          ]
        },
        {
          "name": "Pro",
          "price": "$19/mo",
          "features": [
            "Higher limits",
            "Priority support",
            "Advanced features"
          ]
        },
        {
          "name": "Team",
          "price": "$99/mo",
          "features": [
            "Team seats",
            "SSO",
            "Audit logs"
          ]
        }
      ]
    },
    "features": [
      "Templates",
      "Long-context",
      "RAG",
      "Batch actions",
      "Embeddings",
      "Export"
    ],
    "platforms": [
      "Web",
      "API",
      "iOS",
      "Android"
    ],
    "models": [
      "OpenAI",
      "Anthropic",
      "Llama 3.1"
    ],
    "integrations": [
      "Slack",
      "Zapier",
      "Notion",
      "GSheets"
    ],
    "languages": [
      "en",
      "es",
      "fr",
      "de",
      "hi",
      "ja"
    ],
    "maturity": "growing",
    "release_date": "2023-01-01",
    "updated_at": "2025-10-04",
    "status": "active",
    "compliance": [
      "GDPR",
      "SOC2"
    ],
    "vendor": {
      "name": "Vertex AI",
      "hq_country": "US",
      "contact_email": "hi@cloud.google.com",
      "twitter": "https://x.com/vertex-ai",
      "linkedin": "https://www.linkedin.com/company/vertex-ai"
    },
    "community": {
      "rating": 4.3,
      "votes": 2949,
      "reviews": []
    },
    "seo": {
      "keywords": [
        "Developer Tools",
        "Deploy",
        "Agents",
        "Train"
      ],
      "canonical_url": "https://yourdomain.com/tools/vertex-ai",
      "schema_org": [
        "SoftwareApplication",
        "Product"
      ]
    },
    "flags": {
      "free": true,
      "no_signup": false,
      "open_source": false,
      "mobile_app": true,
      "api_available": true,
      "on_device": false,
      "privacy_first": false,
      "educational": false,
      "nsfw": false,
      "verified": true
    },
    "links": {
      "docs": "https://cloud.google.com/help",
      "changelog": "https://cloud.google.com/changelog",
      "support": "https://cloud.google.com/support",
      "pricing": "https://cloud.google.com/pricing"
    },
    "affiliate": {
      "enabled": false,
      "link": "",
      "partner_id": ""
    },
    "moderation": {
      "submitted_by": "bulk-seed",
      "moderation_state": "approved",
      "notes": ""
    },
    "best_for": [
      "Solo creators",
      "Small teams",
      "Agencies",
      "Enterprises"
    ],
    "use_cases": [
      "Train",
      "Deploy",
      "Agents",
      "Automations",
      "Reporting"
    ],
    "pros_cons": {
      "pros": [
        "Clean UI",
        "Solid performance",
        "Helpful docs",
        "Active community"
      ],
      "cons": [
        "Advanced features in paid plans",
        "Learning curve for complex flows"
      ]
    },
    "key_differentiators": [
      "Fast setup",
      "Good defaults",
      "Solid integrations",
      "Transparent pricing",
      "Active roadmap",
      "Helpful templates"
    ],
    "limitations": [
      "Team features require paid plan",
      "Rate limits on free tier"
    ],